|p_url|target|p_type|p_image_url|p_video_url|p_post_text|reactions_type|reactions|p_inner_descrption|p_date
269|https://www.instagram.com/p/CSVPhJNsAm4/|medplus.mp|image|https://scontent-bog1-1.cdninstagram.com/v/t51.2885-15/234732184_1210634236106049_28809523568913040_n.jpg?stp=dst-jpg_e35&_nc_ht=scontent-bog1-1.cdninstagram.com&_nc_cat=109&_nc_ohc=MTDdSiuG4wIAX_HK5sf&edm=ALQROFkBAAAA&ccb=7-5&ig_cache_key=MjYzNjA4MTQwNTIyOTAwOTMzNg%3D%3D.2-ccb7-5&oh=00_AfC1qBkMXWFB44UbHJ-QpB3dUoP1FPJ47R2tuYK5fkt4mw&oe=63885C01&_nc_sid=30a2ef||['La presión arterial es la fuerza que ejerce la sangre al empujar contra las paredes de las arterias. Al subir no presenta síntomas pero sí puede generarte padecimientos importantes.\n\nEn MedPlus Agosto es la #CulturaDeLosNúmerosDelCorazón. Te contamos 7 claves para que tu presión arterial esté en los niveles normales.\n\n¡Recuerda tomarte la presión una vez al mes!\n\n#CorazonesResponsables #CulturaDeLosNúmerosDelCorazón #MedPlusTeCuida']|Me_gusta|18|['Photo by MedPlus Medicina Prepagada on August 08, 2021.']|2021-08-08 23:30:13+00:00
270|https://www.instagram.com/p/CSUROK7Bep-/|medplus.mp|image|https://scontent-bog1-1.cdninstagram.com/v/t51.2885-15/234296384_526876521964433_7610914899017468101_n.jpg?stp=dst-jpg_e15&_nc_ht=scontent-bog1-1.cdninstagram.com&_nc_cat=105&_nc_ohc=w3EEXDmVUhgAX8Fw4cH&edm=ALQROFkBAAAA&ccb=7-5&ig_cache_key=MjYzNTgwNzQyMjUwOTYwNzU1MA%3D%3D.2-ccb7-5&oh=00_AfCw29qfuppYnX-x0UK1jtEiicedIvUohoYLAl3y3iPzUw&oe=638893CB&_nc_sid=30a2ef||"['El corazón es el órgano central de la circulación de la sangre. Su función es ""bombearla"" para que todos los elementos nutritivos que el cuerpo necesita circulen por las arterias.\n\nEn MedPlus Agosto es la #CulturaDeLosNúmerosDelCorazón. Te contamos las cifras ideales para que tu corazón ❤️ funcione correctamente y te invitamos a realizar chequeos periódicos con tu médico 👨🏻\u200d⚕️ para revisar que todo vaya bien.\n\n#CorazonesResponsables #CulturaDeLosNúmerosDelCorazón #MedPlusTeCuida']"|Me_gusta|20|['Photo by MedPlus Medicina Prepagada on August 08, 2021.']|2021-08-08 14:25:51+00:00
271|https://www.instagram.com/p/CSR6cuwlbQy/|medplus.mp|image|https://scontent-bog1-1.cdninstagram.com/v/t51.2885-15/233463184_626157508300579_6222241742349835152_n.jpg?stp=dst-jpg_e15&_nc_ht=scontent-bog1-1.cdninstagram.com&_nc_cat=107&_nc_ohc=uckr4LfR5GkAX9hFBZX&edm=ALQROFkBAAAA&ccb=7-5&ig_cache_key=MjYzNTE0NDMxNTE4NjUyNDQ0Mg%3D%3D.2-ccb7-5&oh=00_AfC9x3YDjVe4IpC-wkukdN4Oyg-V2Wfk70ZjvvSe76l-yg&oe=63893D7F&_nc_sid=30a2ef||['Aunque fueron desarrolladas en tiempo récord por causa de la pandemia mundial, las vacunas contra el virus del Covid 19 cumplieron con rigurosos estándares científicos de efectividad y calidad de fabricación, por lo que su uso es completamente seguro y confiable.\n\n¡Vacunarte es la mejor forma de cuidarte y proteger a los que más quieres!']|Me_gusta|16|['Photo by MedPlus Medicina Prepagada on August 07, 2021.']|2021-08-07 16:28:23+00:00
272|https://www.instagram.com/p/CSPzQujNnmY/|medplus.mp|image|https://scontent-bog1-1.cdninstagram.com/v/t51.2885-15/234209695_2824360174447812_6607278209708263181_n.jpg?stp=dst-jpg_e15&_nc_ht=scontent-bog1-1.cdninstagram.com&_nc_cat=100&_nc_ohc=Dk6FNts38eEAX8pIQhk&edm=ALQROFkBAAAA&ccb=7-5&ig_cache_key=MjYzNDU0OTc1MjgyNDYwMzU3OQ%3D%3D.2-ccb7-5&oh=00_AfDWD6-gPQdgAUKN_FsXcBBrQfn83QeG3m6LxrcjuXzkUw&oe=63883810&_nc_sid=30a2ef||['Este 7 de Agosto, la oficina móvil MedPlus llega a La Heroica cargada de salud para todos los cartageneros.\n\nVisítanos y juntos elijamos el plan de medicina prepagada ideal para tu familia 👨\u200d👩\u200d👦\u200d👦👩\u200d👧\u200d👦👨\u200d👨\u200d👧\u200d👧. ¡Te esperamos!\n\n#MedPlusCuidaDeTi #OficinaMóvil #Cartagena']|Me_gusta|26|['Photo by MedPlus Medicina Prepagada on August 06, 2021.']|2021-08-06 20:47:06+00:00
273|https://www.instagram.com/p/CSPL2ijMAgw/|medplus.mp|image|https://scontent-bog1-1.cdninstagram.com/v/t51.2885-15/232460168_528056795174925_7029165873944776661_n.jpg?stp=dst-jpg_e15&_nc_ht=scontent-bog1-1.cdninstagram.com&_nc_cat=109&_nc_ohc=wkmWCRF-fWoAX_H7rlW&edm=ALQROFkBAAAA&ccb=7-5&ig_cache_key=MjYzNDM3NjQyODk5OTg3MDM3NQ%3D%3D.2-ccb7-5&oh=00_AfDOBI1pWBYhnHJNFO6zVWMPnjgbTeqwXwE53dlwikntiw&oe=63881724&_nc_sid=30a2ef||['MedPlus presenta el RunTrail Sopo 12K, un evento realizado por virtual challenges de manera presencial el 22 de agosto.\n12K en los que pondrás a prueba tu resistencia mientras disfrutas de los mejores paisajes de la sabana. Hemos trabajado en conjunto para ofrecerte un evento con los mejores estándares de bioseguridad.\n\n#MedPlusTeCuida #CulturaDelMovimiento #VirtualChallenges']|Me_gusta|18|['Photo by MedPlus Medicina Prepagada on August 06, 2021.']|2021-08-09 21:49:36+00:00
274|https://www.instagram.com/p/CSNLVGzMCpV/|medplus.mp|image|https://scontent-bog1-1.cdninstagram.com/v/t51.2885-15/234171883_1289036458187488_74089420622189054_n.jpg?stp=dst-jpg_e15&_nc_ht=scontent-bog1-1.cdninstagram.com&_nc_cat=104&_nc_ohc=jscxJKwvtwAAX_Sc0Er&edm=ALQROFkBAAAA&ccb=7-5&ig_cache_key=MjYzMzgxMTE4MTU1NzU3MzU5MA%3D%3D.2-ccb7-5&oh=00_AfBUXnlUFiuZc9bvxwr2hh8C8EQwhyKvCSExT7BbMm22JQ&oe=6387D480&_nc_sid=30a2ef||['MedPlus y Virtual Challenges te invitan a sumarte al primer reto presencial del 2021 en Sopó, Cundinamarca.\n\n12K de ejercicio 🏃🏼, aire puro y movimiento que tu cuerpo, tu corazón y tu mente agradecerán. #MedPlusTeCuida #CulturaDelMovimiento #VirtualChallenges']|Me_gusta|14|['Photo by MedPlus Medicina Prepagada on August 05, 2021.']|2021-08-05 22:31:41+00:00
275|https://www.instagram.com/p/CSMewBPL8U3/|medplus.mp|image|https://scontent-bog1-1.cdninstagram.com/v/t51.2885-15/233207207_549589039426052_8079061491679630266_n.jpg?stp=dst-jpg_e15&_nc_ht=scontent-bog1-1.cdninstagram.com&_nc_cat=108&_nc_ohc=sCWY0IaR5k0AX_ffbkR&edm=ALQROFkBAAAA&ccb=7-5&ig_cache_key=MjYzMzYxNTEyMDg1NTQ2NTU2NQ%3D%3D.2-ccb7-5&oh=00_AfBrAW_LKfd6y9KFNKc1fj0S2nv0XBcUuhKKP4TkjWTwPQ&oe=63886A9B&_nc_sid=30a2ef||['MedPlus en alianza con el País de Cali , te invitan a unirte a el conversatorio virtual: La salud somos todos, oportunidades y fortalezas del sector en la región. ¡Te esperamos el próximo jueves 12 de agosto a las 11:00am!']|Me_gusta|20|['Photo by MedPlus Medicina Prepagada on August 05, 2021.']|2021-08-05 13:50:09+00:00
276|https://www.instagram.com/p/CSKw03QlM-y/|medplus.mp|image|https://scontent-bog1-1.cdninstagram.com/v/t51.2885-15/230586949_118010040562656_3522236793393432685_n.jpg?stp=dst-jpg_e15&_nc_ht=scontent-bog1-1.cdninstagram.com&_nc_cat=100&_nc_ohc=o3bVl4VtJVkAX9Izsns&edm=ALQROFkBAAAA&ccb=7-5&ig_cache_key=MjYzMzEzMTY2OTU0NTQ2NTMwNQ%3D%3D.2-ccb7-5&oh=00_AfA54-uK9ztZ7Zcm6zAeBAMl2dq-r1vnwE22P09IwOYf6g&oe=63884959&_nc_sid=30a2ef||['Queremos brindarte espacios a la vanguardia para que de una manera diferente vivas una experiencia inolvidable, mientras te mantienes activo y saludable. Por eso nos sumamos al reto Virtual Challenges 2021.\n\n¡Espera pronto más información! 😯😎\n\n#MedPlusTeCuida #CulturaDelMovimiento #VirtualChallenges']|Me_gusta|28|['Photo by MedPlus Medicina Prepagada on August 04, 2021.']|2021-08-04 21:49:37+00:00
277|https://www.instagram.com/p/CSKkatgs6vS/|medplus.mp|image|https://scontent-bog1-1.cdninstagram.com/v/t51.2885-15/228684550_1767918483411175_8908501569107192640_n.jpg?stp=dst-jpg_e15&_nc_ht=scontent-bog1-1.cdninstagram.com&_nc_cat=107&_nc_ohc=gJxQtcnBPd8AX_GG34L&edm=ALQROFkBAAAA&ccb=7-5&ig_cache_key=MjYzMzA3NzA5NDM2MjUxOTAyNw%3D%3D.2-ccb7-5&oh=00_AfC8frvz4ImhWgLuJ7XNqzDwJ1tZc3ZtE0qhjw3KJRz7OA&oe=638933C4&_nc_sid=30a2ef||['En los centros médicos BlueCare de Bogotá y Medellín, obtén el servicio y la atención que te mereces, un experto muy cerca de ti. #experienciamemorablebluecare #unexpertoparati']|Me_gusta|63|['Photo by MedPlus Medicina Prepagada on August 04, 2021.']|2021-08-04 20:01:11+00:00
278|https://www.instagram.com/p/CSKPvOULBMU/|medplus.mp|image|https://scontent-bog1-1.cdninstagram.com/v/t51.2885-15/232956427_396313031849435_4161986640292081138_n.jpg?stp=dst-jpg_e15&_nc_ht=scontent-bog1-1.cdninstagram.com&_nc_cat=111&_nc_ohc=0McwbXWPR-cAX_8mT_f&edm=ALQROFkBAAAA&ccb=7-5&ig_cache_key=MjYzMjk4NjE0NTE0OTg2NjEwNw%3D%3D.2-ccb7-5&oh=00_AfBigp46CagBgcO2YH6dQi39mGs-j3ySQzsDROo3MdQMGA&oe=638943A1&_nc_sid=30a2ef||['Por siglos, las vacunas 💉 han salvado la vida de millones de personas.\n\nLas del Covid-19 son seguras, disminuyen el riesgo de contagio y ayudan a lograr la inmunidad.\n\n¡Vacunarse es cuidar de ti y de los demás!']|Me_gusta|19|['Photo by MedPlus Medicina Prepagada on August 04, 2021.']|2021-08-04 17:00:29+00:00
279|https://www.instagram.com/p/CSKB1mLA96G/|medplus.mp|image|https://scontent-bog1-1.cdninstagram.com/v/t51.2885-15/231848688_2967090790225095_395626601534937383_n.jpg?stp=dst-jpg_e35&_nc_ht=scontent-bog1-1.cdninstagram.com&_nc_cat=103&_nc_ohc=U9HqkFCFIJ0AX8-NLhZ&edm=ALQROFkBAAAA&ccb=7-5&ig_cache_key=MjYzMjkyNTAxMDMzMDY4ODgyNQ%3D%3D.2-ccb7-5&oh=00_AfCpU8g9xfGjUsUXi44-b_vUxWgqt4MaTnrK9IIHcADWEA&oe=638884D1&_nc_sid=30a2ef||['En la semana mundial de la lactancia materna MedPlus quiere generar conciencia sobre la necesidad de apoyar a las madres 🤱🏼 para que amamanten en cualquier momento y cualquier lugar.\n\n¡Todos podemos ser agentes de cambio!\n\n#SemanaMundialDeLaLactanciaMaterna #MedPlusTeCuida\n#CuidamosDeTi']|Me_gusta|12|['Photo by MedPlus Medicina Prepagada on August 04, 2021.']|2021-08-04 14:59:02+00:00
280|https://www.instagram.com/p/CSHrfYtLwHu/|medplus.mp|image|https://scontent-bog1-1.cdninstagram.com/v/t51.2885-15/231173670_2729383917362098_4317081921066054458_n.jpg?stp=dst-jpg_e35&_nc_ht=scontent-bog1-1.cdninstagram.com&_nc_cat=110&_nc_ohc=mtVcr71RX_MAX9ziJ6E&edm=ALQROFkBAAAA&ccb=7-5&ig_cache_key=MjYzMjI2Mzc4MDA1Mjk1OTcyNg%3D%3D.2-ccb7-5&oh=00_AfC7e_2ckcakMKJl70EKLz7xA3qwpYnZO88heH3bkxZHoQ&oe=63880CE9&_nc_sid=30a2ef||['Recuerda que por asistir a nuestro Especialistas Live podrás ganar increíbles premios.\n\nPara participar, debes seguir los siguientes pasos:\n\n✅ 📌 MENCIONA a 2 amigos para que participen del especialistas live *recuerda deben ser cuentas reales, no se cuentan empresas y/o famosos\n✅DALE like a esta publicación .\n✅SIGUE nuestro perfil @Medplus.mp y @BlueCare para estar al día de nuestras novedades.\n✅ Las tres personas que respondan correctamente las preguntas realizadas en el live serán los ganadores\n✅Es muy importante que tengas perfil público para verificar que nos sigas.\n\n¡No te lo puedes perder!']|Me_gusta|13|['Photo by MedPlus Medicina Prepagada on August 03, 2021.']|2021-08-03 17:05:16+00:00
281|https://www.instagram.com/p/CSFnLgnJAhL/|medplus.mp|image|https://scontent-bog1-1.cdninstagram.com/v/t51.2885-15/230400539_880285216226519_7224829031543189812_n.jpg?stp=dst-jpg_e35&_nc_ht=scontent-bog1-1.cdninstagram.com&_nc_cat=111&_nc_ohc=pUkCugDsUvkAX9qOX5Y&edm=ALQROFkBAAAA&ccb=7-5&ig_cache_key=MjYzMTY4MTg2ODM2MzY5MDY3Mw%3D%3D.2-ccb7-5&oh=00_AfDh_27MQbiit4rc1g1qdajfxRoND3WuJOBuitc9btJl1w&oe=6388701C&_nc_sid=30a2ef||['¡MedPlus llegó a Cartagena !🇨🇴\n\nEstaremos desde el martes 3 de agosto hasta el sábado 7 de agosto; visítanos y encuentra el plan de medicina prepagada que se ajusta a tus necesidades.\n\n¡Vive la experiencia MedPlus 🚌🩺⚕, Te esperamos! #Cartagena #Salud #Medplus']|Me_gusta|22|['Photo by MedPlus Medicina Prepagada on August 02, 2021.']|2021-08-02 21:49:08+00:00
282|https://www.instagram.com/p/CSAHByir1l3/|medplus.mp|image|https://scontent-bog1-1.cdninstagram.com/v/t51.2885-15/230018654_557407355295934_2345314766101452645_n.jpg?stp=dst-jpg_e35&_nc_ht=scontent-bog1-1.cdninstagram.com&_nc_cat=110&_nc_ohc=6Njyn-Dnt_gAX8uCET-&edm=ALQROFkBAAAA&ccb=7-5&ig_cache_key=MjYzMDEzMzA4NzYzODM2NzY0MQ%3D%3D.2-ccb7-5&oh=00_AfCBhhlH8EJdYAOqZa6O-gSUruo4SRSf5VNKKdtCzXucdA&oe=63897197&_nc_sid=30a2ef||['Te mereces estar informado, ya abrieron vacunación para personas mayores a 25 años, accede al puesto de vacunación más cercano.\n\n#YoMeVacuno']|Me_gusta|18|['Photo by MedPlus Medicina Prepagada on July 31, 2021.']|2021-07-31 18:31:59+00:00
283|https://www.instagram.com/p/CR9pHEmNhP6/|medplus.mp|image|https://scontent-bog1-1.cdninstagram.com/v/t51.2885-15/226474379_1304739859928373_5885443550668047114_n.jpg?stp=dst-jpg_e15&_nc_ht=scontent-bog1-1.cdninstagram.com&_nc_cat=109&_nc_ohc=JUbve2uuXrUAX_J8Mcv&tn=LgdxYoM2i6ygn41M&edm=ALQROFkBAAAA&ccb=7-5&ig_cache_key=MjYyOTQzODU2MzMzMzU3NTY3NA%3D%3D.2-ccb7-5&oh=00_AfA2gJsdAzzNxbtCvQQpaMweLK-LxNkGyeoNMAVy71hRRQ&oe=6387B7E8&_nc_sid=30a2ef||['La amistad se define como el afecto personal 💜 sincero y desinteresado, generalmente recíproco, que nace y se fortalece entre dos personas.\n\nTener verdaderos amigos es un regalo 🎁 de infinito valor.\n\n#MedPlusTeCuida #DíaInternacionalDeLaAmistad']|Me_gusta|19|['Photo by MedPlus Medicina Prepagada on July 30, 2021.']|2021-07-30 19:32:04+00:00
284|https://www.instagram.com/p/CR9ZK3ztRwr/|medplus.mp|image|https://scontent-bog1-1.cdninstagram.com/v/t51.2885-15/226192442_6136021699771658_6839723960462899860_n.jpg?stp=dst-jpg_e15&_nc_ht=scontent-bog1-1.cdninstagram.com&_nc_cat=102&_nc_ohc=7ZceRO67mswAX9E8_yy&edm=ALQROFkBAAAA&ccb=7-5&ig_cache_key=MjYyOTM2ODQ1NTczNTA5MDIxOQ%3D%3D.2-ccb7-5&oh=00_AfB5-P5XBlH548ZvD4Q5OKxY-7hNIdM7YLDNgxFqD09a2A&oe=6388802A&_nc_sid=30a2ef||['Tu opinión es muy importante para nosotros, califica tu experiencia en servicio ingresando al link que se encuentra en nuestra biografía ☝🏻\nTodo lo que hacemos es por ti.\n\n#MedPlus']|Me_gusta|23|['Photo by MedPlus Medicina Prepagada on July 30, 2021.']|2021-07-30 17:12:47+00:00
285|https://www.instagram.com/p/CR7bTM-tZiP/|medplus.mp|image|https://scontent-bog1-1.cdninstagram.com/v/t51.2885-15/227246710_512831479997102_4580773554056989770_n.jpg?stp=dst-jpg_e35&_nc_ht=scontent-bog1-1.cdninstagram.com&_nc_cat=102&_nc_ohc=JH4q1XIonHAAX9nLw_x&edm=ALQROFkBAAAA&ccb=7-5&ig_cache_key=MjYyODgxNDg3MTM2ODkyNjU0MA%3D%3D.2-ccb7-5&oh=00_AfDJJAg2xgpjnE9J3q37nlTFJJTjQbOjI3FSxYtsBejEPg&oe=6388FE24&_nc_sid=30a2ef||['Hacer ejercicio ⛸️ 🎾 es una parte muy importante de tu rutina, sin embargo, lo que comes 🥑 🐠 después es clave para no perder el esfuerzo realizado.\n\nTe contamos 5 alimentos ideales para consumir después de tu rutina de ejercicio.\n\n#MedPlusTeCuida #SaludMental #AlimentaciónSaludable #CulturaDelMovimiento']|Me_gusta|33|['Photo by MedPlus Medicina Prepagada on July 29, 2021.']|2021-07-29 22:52:55+00:00
286|https://www.instagram.com/p/CR7Cd5UpXaq/|medplus.mp|image|https://scontent-bog1-1.cdninstagram.com/v/t51.2885-15/228918967_714592789350875_5143826739058172035_n.jpg?stp=dst-jpg_e35&_nc_ht=scontent-bog1-1.cdninstagram.com&_nc_cat=111&_nc_ohc=OG-0mL_ukq4AX_KhRKZ&edm=ALQROFkBAAAA&ccb=7-5&ig_cache_key=MjYyODcwNTY1NDc0NTA4NDU5Mg%3D%3D.2-ccb7-5&oh=00_AfCqMkuG6VcHBiTLDKUDvhJCteQP_1l_t5H3lLUHJFT2pg&oe=6387DD30&_nc_sid=30a2ef||['¡En MedPlus te mantenemos informado!\n\nRecuerda mantener las medidas de bioseguridad; cuándo llegue tu turno acude a tu EPS o averigua los puntos autorizados para vacunación en: www.minsalud.gov.co\n\n#Yomevacuno']|Me_gusta|42|['Photo by MedPlus Medicina Prepagada on July 29, 2021.']|2021-07-29 19:15:55+00:00
287|https://www.instagram.com/p/CR4v-l8lYxD/|medplus.mp|image|https://scontent-bog1-1.cdninstagram.com/v/t51.2885-15/225272942_851237128829524_7940498252934749077_n.jpg?stp=dst-jpg_e15&_nc_ht=scontent-bog1-1.cdninstagram.com&_nc_cat=104&_nc_ohc=zm58n62J4Z4AX-tXnYB&edm=ALQROFkBAAAA&ccb=7-5&ig_cache_key=MjYyODA2MTM5MjEwOTE0NTE1NQ%3D%3D.2-ccb7-5&oh=00_AfB8snp6w2ppWGSCdWxG7bpAB1w0aGLbuZBdKViILxx9jA&oe=63888390&_nc_sid=30a2ef||['¡Reserva tu fecha! 🗓️\n\nEl jueves 5 de agosto a las 6:00 pm Especialistas live, el movimiento es vida.\n\nEn compañía de nuestros expertos te compartiremos tips, ejercicios, pausas activas y más actividades para implementar en tu rutina.\n\n¡No te lo pierdas!💪']|Me_gusta|12|['Photo shared by MedPlus Medicina Prepagada on July 28, 2021 tagging @bluecarecol.']|2021-07-28 22:01:16+00:00
288|https://www.instagram.com/p/CR4J5OJr66s/|medplus.mp|image|https://scontent-bog1-1.cdninstagram.com/v/t51.2885-15/226128351_1024919431579416_1654440785744653335_n.jpg?stp=dst-jpg_e15&_nc_ht=scontent-bog1-1.cdninstagram.com&_nc_cat=100&_nc_ohc=6jzCncDvG3IAX_-3ABP&edm=ALQROFkBAAAA&ccb=7-5&ig_cache_key=MjYyNzg5Mzg5MzQyNzY2OTgyNQ%3D%3D.2-ccb7-5&oh=00_AfDZ68Y9RoyUub6rjXA57NkLHmPpyFvy2vWfYB1WGYBcXg&oe=63879206&_nc_sid=30a2ef||['Las hepatitis virales son la causa de alrededor de 1,4 millones de muertes al año a nivel mundial.\n\nPueden manifestarse con síntomas como: fiebre 🤒, coloración amarillenta de la piel, los ojos y las mucosas 👩\u200d, dolor abdominal, orina oscura, heces blanquecinas, náuseas, vómito 🤢, pérdida de apetito, movimientos intestinales y dolor en las articulaciones.\n\nSi presentas dos o más de estos síntomas ¡Acude al especialista 🏥!\n\nFuente: Ministerio de Salud Colombia\n\n#MedPlus #DíaMundialDeHepatitisVírica #PromociónYPrevención']|Me_gusta|20|['Photo by MedPlus Medicina Prepagada on July 28, 2021.']|2021-07-28 16:23:06+00:00
289|https://www.instagram.com/p/CR327T4p9tN/|medplus.mp|image|https://scontent-bog1-1.cdninstagram.com/v/t51.2885-15/225493589_1796707790530687_9035599014830112676_n.jpg?stp=dst-jpg_e35&_nc_ht=scontent-bog1-1.cdninstagram.com&_nc_cat=107&_nc_ohc=aohWE-jTR-IAX9bH2Ts&edm=ALQROFkBAAAA&ccb=7-5&ig_cache_key=MjYyNzgxMDQ3MzcxMTk1MTE3NQ%3D%3D.2-ccb7-5&oh=00_AfBQ4zCgNSjJAKjgWpdiaOINmSDUeLApVIC9pgB3_WjHlA&oe=63887C31&_nc_sid=30a2ef||['¡MedPlus está en Barranquilla!🇨🇴\nVisítanos hoy Miércoles 28 de julio en el parque la paz y conoce el plan de medicina prepagada que se ajusta a tus necesidades y la de los tuyos.\n¡Vive la experiencia MedPlus, te esperamos!']|Me_gusta|25|['Photo by MedPlus Medicina Prepagada on July 28, 2021.']|2021-07-28 13:37:21+00:00
290|https://www.instagram.com/p/CR1YqfqJ74O/|medplus.mp|image|https://scontent-bog1-1.cdninstagram.com/v/t51.2885-15/225823794_230100568963784_6814867932674230162_n.jpg?stp=dst-jpg_e35&_nc_ht=scontent-bog1-1.cdninstagram.com&_nc_cat=108&_nc_ohc=s_MHDqnnQyAAX_Qfbkx&edm=ALQROFkBAAAA&ccb=7-5&ig_cache_key=MjYyNzExNDQyNzYzNzc2NDE3OQ%3D%3D.2-ccb7-5&oh=00_AfAC9r8-ftjbuCvWKc6JR-aQk7h_U1ttTi2y8qoPZ0GrHA&oe=63885811&_nc_sid=30a2ef||['¡MedPlus se toma Barranquilla!🇨🇴\n\nVisítanos hoy Martes 27 de julio en el parque electrificadora y conoce el plan de medicina prepagada que se ajusta a tus necesidades\n¡Vive la experiencia MedPlus, te esperamos! 🚌🩺⚕']|Me_gusta|30|['Photo by MedPlus Medicina Prepagada on July 27, 2021.']|2021-07-27 14:34:26+00:00
291|https://www.instagram.com/p/CRzeAnCpmkK/|medplus.mp|image|https://scontent-bog1-1.cdninstagram.com/v/t51.2885-15/224230270_1192998761125477_5596414558880326696_n.jpg?stp=dst-jpg_e35&_nc_ht=scontent-bog1-1.cdninstagram.com&_nc_cat=101&_nc_ohc=7AIAHMPudlIAX9LzfT_&edm=ALQROFkBAAAA&ccb=7-5&ig_cache_key=MjYyNjU3NDk4NzA0MzI4MjIxMA%3D%3D.2-ccb7-5&oh=00_AfCIvZFs9J3xmxhrIGcjK6Sr9RRQcfR2nuyIV6X7a2_UGw&oe=63886C59&_nc_sid=30a2ef||['¡Comenzamos recorrido!\n\nPrimera Parada: Barranquilla\n\nVisítanos desde el martes 27 al sábado 31 de julio, vive una experiencia MedPlus y conoce el plan de medicina prepagada que se adapta a tus necesidades.\n\n¡Te esperamos!']|Me_gusta|34|['Photo by MedPlus Medicina Prepagada on July 26, 2021.']|2021-07-26 20:42:40+00:00
292|https://www.instagram.com/p/CRzK2UfJq_S/|medplus.mp|image|https://scontent-bog1-1.cdninstagram.com/v/t51.2885-15/223500703_544168966779638_4592760136425172958_n.jpg?stp=dst-jpg_e35&_nc_ht=scontent-bog1-1.cdninstagram.com&_nc_cat=102&_nc_ohc=F8uPc80HK_oAX_pCIQ0&edm=ALQROFkBAAAA&ccb=7-5&ig_cache_key=MjYyNjQ5MDcyMTAwMTQ1MTQ3NA%3D%3D.2-ccb7-5&oh=00_AfC7SFnyYKSinN0LWqPRkrSE4J_MenQwUnjXyQkt0X4imA&oe=6389142B&_nc_sid=30a2ef||['En MedPlus estamos cada vez más cerca, por eso queremos escucharte y conocer tu opinión.\n\n¡Muy pronto !\n\n#loestamoshaciendoporti']|Me_gusta|19|['Photo by MedPlus Medicina Prepagada on July 26, 2021.']|2021-07-26 17:55:14+00:00
293|https://www.instagram.com/p/CRwxeTUJTXR/|medplus.mp|video|https://scontent-bog1-1.cdninstagram.com/v/t51.2885-15/223265441_804450966909864_6938911205995156832_n.jpg?stp=dst-jpg_e35&_nc_ht=scontent-bog1-1.cdninstagram.com&_nc_cat=100&_nc_ohc=dy03MhuSsSwAX__7XWm&edm=ALQROFkBAAAA&ccb=7-5&ig_cache_key=MjYyNTgxNjE2OTM1OTQyMjkyOQ%3D%3D.2-ccb7-5&oh=00_AfALpVIY1Vc97xKE2Rd-5pWCfDCeAVy12q8_jX_pKkZ1pA&oe=63879D0B&_nc_sid=30a2ef|blob:https://www.instagram.com/212692e1-acbe-4223-a514-405e260b6eae|['¿Te gustaría estar más activo pero no sabes cómo incluir el movimiento 💃🏼🏃🏽en tu rutina diaria?\n\n¡Este Especialistas Live es para ti!\n\nDe la mano de nuestros expertos vas a aprender valiosas técnicas que te ayudarán a estar más enérgico, saludable y feliz 💪🏻😊.\nAgéndate este jueves 5 de agosto a las 6:00 p.m']|Reproducciones|230|['']|2021-07-25 19:35:15+00:00
294|https://www.instagram.com/p/CRwQ5u6pMOE/|medplus.mp|image|https://scontent-bog1-1.cdninstagram.com/v/t51.2885-15/224756039_347790197010868_2199865038171079901_n.jpg?stp=dst-jpg_e35&_nc_ht=scontent-bog1-1.cdninstagram.com&_nc_cat=104&_nc_ohc=cUsl4HEdITIAX88ObUw&edm=ALQROFkBAAAA&ccb=7-5&ig_cache_key=MjYyNTY3MjkxODg4NzM1MTE3Mg%3D%3D.2-ccb7-5&oh=00_AfDOL064ueoTp9bRsi-PmklhG68c0Gy3BiVQMtHb0479Rg&oe=63889D36&_nc_sid=30a2ef||['¿Sabías que la alimentación equilibrada 🍎 🥒 y el ejercicio frecuente ⛹🏽 🏇🏼 son lo ideal para bajar de peso?\n\nDale click al enlace de nuestra biografía opción cuidamos de ti y conoce las recomendaciones para una dieta balanceada 👆\n\n#MedPlusTeCuida #BajarDePeso #AlimentaciónSaludable #CulturaDelMovimiento']|Me_gusta|17|['Photo by MedPlus Medicina Prepagada on July 25, 2021.']|2021-07-26 16:59:03+00:00
295|https://www.instagram.com/p/CRuXus5JaY2/|medplus.mp|image|https://scontent-bog1-1.cdninstagram.com/v/t51.2885-15/224920166_515916609634998_1739865774574566442_n.jpg?stp=dst-jpg_e35&_nc_ht=scontent-bog1-1.cdninstagram.com&_nc_cat=106&_nc_ohc=vlJgJewRsM8AX_vyGUM&edm=ALQROFkBAAAA&ccb=7-5&ig_cache_key=MjYyNTEzOTk5NzE3MjY3MjA1NA%3D%3D.2-ccb7-5&oh=00_AfAsyBaIjZ5_6dNTioQTmZIFRMajmJsdQZBUMiIr7FEY7w&oe=6389195B&_nc_sid=30a2ef||['La obesidad es uno de los factores de riesgo que pueden abrir la puerta a patologías graves.\n\n¡La buena noticia es que se puede prevenirla con hábitos de vida más saludables! 🍎\n\nNuestro programa Prevenir es Plus busca identificar y tratar tempranamente alertas de salud como la obesidad.\n¡Conócelo en nuestro link de nuestra biografía 👆 !\n\n#MedPlusTeCuida #CulturaDelMovimiento #PrevenirEsPlus #Obesidad']|Me_gusta|17|['Photo by MedPlus Medicina Prepagada on July 24, 2021.']|2021-07-26 16:57:54+00:00
296|https://www.instagram.com/p/CRtlKDup6PT/|medplus.mp|image|https://scontent-bog1-1.cdninstagram.com/v/t51.2885-15/222067213_125912199722207_6674936056644809395_n.jpg?stp=dst-jpg_e35&_nc_ht=scontent-bog1-1.cdninstagram.com&_nc_cat=111&_nc_ohc=kCAM0KcuvZEAX9kKkL-&edm=ALQROFkBAAAA&ccb=7-5&ig_cache_key=MjYyNDkxNzU3Njc0NjUwOTI2Nw%3D%3D.2-ccb7-5&oh=00_AfCBHJpVpX3WNvNuvLS7mGDygVZmI9EFnQwQapzWenKW-A&oe=638799F7&_nc_sid=30a2ef||['Aunque la pandemia del Covid-19 puso de manifiesto la cultura del autocuidado, hacerlo permanentemente es la mejor forma de demostrarnos amor 😍\nEn #MedPlus te invitamos a quererte y cuidarte.\n\n#MedPlusTeCuida #DíaMundialDelAutocuidadoDeLaSalud #AmorPropio']|Me_gusta|16|['Photo by MedPlus Medicina Prepagada on July 24, 2021.']|2021-07-24 13:49:41+00:00
297|https://www.instagram.com/p/CRsCAaqJ-X6/|medplus.mp|image|https://scontent-bog1-1.cdninstagram.com/v/t51.2885-15/221832533_839302386717144_3856948905127293843_n.jpg?stp=dst-jpg_e35&_nc_ht=scontent-bog1-1.cdninstagram.com&_nc_cat=100&_nc_ohc=Iu96eC7vi9wAX8akl-n&edm=ALQROFkBAAAA&ccb=7-5&ig_cache_key=MjYyNDQ4MTUwNDQzMDIwMjMyOA%3D%3D.2-ccb7-5&oh=00_AfCytk7fs1OmbZ4oKzabmYDS6GTTpmfLx3SON-tkeAwvfQ&oe=63886E5E&_nc_sid=30a2ef||['MedPlus te informa,\n\nSi te encuentras en la semana 12 de gestación, hasta los 40 días de posparto puedes acercarte a cualquier punto de vacunación para recibir la vacuna contra la COVID-19.\n\n¡Consulta los puntos de vacunación en: https://bit.ly/3rwAPYi!\n\n#MedPlusTeCuida #Covid19']|Me_gusta|20|['Photo by MedPlus Medicina Prepagada on July 23, 2021.']|2021-07-23 23:23:17+00:00
298|https://www.instagram.com/p/CRr26dpJ8wg/|medplus.mp|image|https://scontent-bog1-1.cdninstagram.com/v/t51.2885-15/222589943_190706006278622_8949936620813986826_n.jpg?stp=dst-jpg_e35&_nc_ht=scontent-bog1-1.cdninstagram.com&_nc_cat=102&_nc_ohc=I_0Ed6yTfZ0AX9Dsv2j&edm=ALQROFkBAAAA&ccb=7-5&ig_cache_key=MjYyNDQzMjcxNjQyODcyOTYxMw%3D%3D.2-ccb7-5&oh=00_AfDFtaLACYWaxo6npRQQ-F0K9Me3dWhaK2YpEzqP2DW84w&oe=6387D9B8&_nc_sid=30a2ef||['¡MedPlus se toma Barranquilla 🏖!\n\nDel 27 al 31 de julio estaremos por toda la ciudad con nuestra oficina móvil 🚌, conoce el plan de Medicina Prepagada ideal para ti y tu familia. 🩺\n\n¡Vive la experiencia MedPlus!\n\n27 de julio: Parque Buenavista-Calle 99 con cra 58.\n\n31 de julio: Plaza del Parque- Calle 99 No. 53-40.\n\n¡Te esperamos!\n\nwww.medplus.com.co']|Me_gusta|24|['Photo by MedPlus Medicina Prepagada on July 23, 2021.']|2021-07-23 21:46:21+00:00
